,Job ID,URL,Job Title,Job Type,Company Name,Job Location,Job Level,Job Industry,Min Salary,Max Salary,Salary Paid,Date Posted,Contract,Internship,Temporary,Permanent,Job Description,Job Requirements
42,c523346cda6590123c21094ca9fd50af,https://www.mycareersfuture.sg/job/research-engineer-astar-research-entities-c523346cda6590123c21094ca9fd50af,Research Engineer (CHEEM),"Contract, Full Time",A*STAR RESEARCH ENTITIES,"UOB PLAZA, 80 RAFFLES PLACE 048624",Non-executive,Sciences / Laboratory / R&D,2500,5000,Monthly,14 Jan 2019,1,0,0,0,"The A*STAR Artificial Intelligence Initiative is seeking exceptional engineers to expand our dynamic and multi-disciplinary AI team. Our current team members have degrees in computer science, robotics, mechanical engineering, product design, information systems, psychology and cognitive science from Berkeley, CMU, NTU, NUS, MIT, Stanford, SMU, SUTD, Yale, etc. We work on some of the most crucial, incredibly hard, and future-oriented problems in AI.   The goal of our programme is to develop next-generation AI technologies that will enable machines to: 1) Learn like humans (as would a child from instruction, demonstration, or experience with a small number of examples); 2) Reason for humans (by being able to explain their reasoning, and to personalise recommendations based on their understanding of individual users); and, 3) Deeply understand humans (using knowledge of human needs/motivations, social/cultural norms, and commonsense).   For an exciting, brand-new project, we are specifically seeking Research Engineers with talent and inclination to pursue first-class research and are keen to join a team looking into developing the next generation of AI technology for collaborative robot applications in Advanced Manufacturing and Engineering. A Masters / Bachelors degree in Computer Science or Computer / Electrical / Mechanical / Robotics Engineering or relevant disciplines is required.   Other requirements: (two or more of the following) •               Familiarity with at least one of programming language (C/C++, Python, etc.) •               Knowledge of Robotics fundamentals •               Knowledge of Reinforcement Learning •               Knowledge of Deep Learning •               Hands-on experience with ROS •               Hands-on experience on DL applications, and familiarity with at least one DL framework (Tensorflow, Pytorch, etc.)",   Masters / Bachelors degree in Computer Science or Computer / Electrical / Mechanical / Robotics Engineering or relevant disciplines Entry level candidates with a track record of the above mentioned are encouraged to apply  The above eligibility criteria are not exhaustive. A*STAR may include additional selection criteria based on its prevailing recruitment policies. These policies may be amended from time to time without notice. We regret that only shortlisted candidates will be notified.
43,13d49bb95a504868c07dfb355c663dcd,https://www.mycareersfuture.sg/job/ai-engineer-youzu-13d49bb95a504868c07dfb355c663dcd,AI Engineer,Full Time,YOUZU (SINGAPORE) PTE. LTD.,"PAYA LEBAR SQUARE, 60 PAYA LEBAR ROAD 409051","Professional, Executive, Senior Executive",Information Technology,5000,7000,Monthly,14 Jan 2019,0,0,0,0,"Yoozoo Interactive is setting up a Center for Artificial Intelligence (AI) and Machine Learning (ML) in Singapore to develop cutting edge digital technologies in interactive multimedia. The Center is looking for passionate AI and ML Engineers who are keen to be part of the team spearheading the development and implementation of digital technologies in this new exciting era for areas such as gaming, healthcare, and marketing.   Specific duties of this role will include: 1.    Review and evaluate the relevance of state-of-the-arts in AI/ML against business requirements. 2.    Support business driven data analytics activities. 3.    Demonstrate expert level ability in the translation of AI/ML methodologies to solve real world issues. 4.    Demonstrate competency in developing robust, scalable, and efficient solutions using the latest advancements in AI/ML techniques. 5.    Develop novel and competitive solutions using AI/ML to fulfill ambitious research agenda. 6.    Develop rapid MVP leveraging on open source libraries and commercial off the shelf tools and platforms. 7.    Active participation in AI/ML Community of Practices.","Qualifications and Competencies: 1.    MSc/MEng with a minimum of 2-3 years work experience in developing challenging AI/ML solutions. 2.    Solid understanding and appreciation of AI/ML concepts and technologies. 3.    Practical working experience handling and analyzing large scale time-series, text, and images. 4.    Excellent coding, documentation, version control, and testing skills in multiple scientific programming platforms (R, Python, etc). 5.    Motivated and enthusiastic to take on new challenging technical problems. 6.    Willingness to learn new technical skills to develop technical competency."
44,a781d0fe818de6c6f93707a2c2255137,https://www.mycareersfuture.sg/job/data-analyst-abakus-a781d0fe818de6c6f93707a2c2255137,Data Analyst,Permanent,ABAKUS (ASIA PACIFIC) PTE. LTD.,,"Executive, Junior Executive",Information Technology,4000,5500,Monthly,13 Jan 2019,0,0,0,1,"To reinvent an industry, you need to build an all-star team. Join Wecash if you want to realise a world of better living through responsible credit, by developing and promoting products that provide businesses with comprehensive and accurate evaluation of consumer credit worthiness as well as underwrite loans between funding sources and consumers. Wecash leverage upon the power of mobile technology, big data and machine learning to prevent fraud and determine consumer credit worthiness. Wecash started in 2014 and has since raised more than US$200 million in financing, acquired over 100 million users and processed more than US$5 billion in loans in 2017 alone. Wecash is creating a platform for financial products for the financially underserved utilizing artificial intelligence, big data and mobile technology. At Wecash, we move quickly, get stuff done, and are constantly iterating. Our innovative data science team of Wecash is looking for team mates who is keen on data analytics to join them in evaluating personal credit and detect financial fraud behaviours. You enjoy working on large data sets in a team with R&D culture. You are a self-starter and motivated to work within a team solving real-world problems and delivering the results. Responsibilities  Find model issues and propose method to improvement of model from evidence Interpret data, analyze results using statistical techniques and provide ongoing reports Develop case study and conduct experiments to identify, analyze, and interpret trends or patterns in complex data sets Process & visualize data and build features of the model Develop model to detect data outlier Identify and incorporate new data source that can benefit our business.   "," Demonstrated project experience in data science. Some knowledge of common data analytical models. Ability to interpret data and demonstrates the result to the team with critical thinking. Good programming skills in Python and database query. Strong analytical skills with the ability to collect, organize, analyze, and disseminate significant amounts of information with attention to detail and accuracy Adept at queries, report writing and presenting findings Undergraduate or Master’s in Computer Science, Engineering, Statistics, Mathematics or Quantitative Finance. Willing to learn, innovative, good communication skills and team player  Bonus skills  Ability to communicate in Mandarin or Bahasa Indonesia or other Asian language to communicate with counterparts in China, Indonesia and other APAC offices. Relevant working experience in the financial industry. "
45,ec80cf4678d1bf50b66a251f06283161,https://www.mycareersfuture.sg/job/data-engineer-abakus-ec80cf4678d1bf50b66a251f06283161,Data Engineer,Permanent,ABAKUS (ASIA PACIFIC) PTE. LTD.,,Executive,Information Technology,5500,7000,Monthly,13 Jan 2019,0,0,0,1,"To reinvent an industry, you need to build an all-star team. Join Wecash if you want to realise a world of better living through responsible credit, by developing and promoting products that provide businesses with comprehensive and accurate evaluation of consumer credit worthiness as well as underwrite loans between funding sources and consumers. Wecash leverage upon the power of mobile technology, big data and machine learning to prevent fraud and determine consumer credit worthiness. Wecash started in 2014 and has since raised more than US$200 million in financing, acquired over 100 million users and processed more than US$5 billion in loans in 2017 alone. Wecash is creating a platform for financial products for the financially underserved utilizing artificial intelligence, big data and mobile technology. At Wecash, we move really quickly, get stuff done, and are constantly iterating. We are looking for a data engineer to support our expansion in Southeast Asia who will collaborate with the Data Science team to streamline our data products for analytics, operation and research. The candidate should be proactive and willing to keep-up with cutting-edge technologies. Responsibilities:  Develop, deploy and maintain machine learning models Design simulation and testing frameworks for model validation Identify, collect and organize new data sources Research on new technologies for efficient data management   "," Degree in Computer Science/Mathematics/Statistics/Physics, or related fields Proficiency in Python, SQL and Linux shell with minimum 1 year of hands-on experience Experience in statistical modelling Knowledge in Web Frameworks and RESTful APIs Knowledge in Version Control and Continuous Integration tools Willing to learn, innovative, good communication skills and team player  Bonus Skills  Working experience in NoSQL Working experience in Machine learning Ability to communicate in Mandarin or Bahasa Indonesia or other Asian language to communicate with counterparts in China, Indonesia and other APAC offices. "
46,30773057cec6241994d9a7397a59573b,https://www.mycareersfuture.sg/job/data-scientist-abakus-30773057cec6241994d9a7397a59573b,Data Scientist,Permanent,ABAKUS (ASIA PACIFIC) PTE. LTD.,,"Manager, Professional, Senior Executive","Banking and Finance, Information Technology",7000,13000,Monthly,13 Jan 2019,0,0,0,1,"To reinvent an industry, you need to build an all-star team. Join Wecash if you want to realise a world of better living through responsible credit, by developing and promoting products that provide businesses with comprehensive and accurate evaluation of consumer credit worthiness as well as underwrite loans between funding sources and consumers. Wecash leverage upon the power of mobile technology, big data and machine learning to prevent fraud and determine consumer credit worthiness. Wecash started in 2014 and has since raised more than US$200 million in financing, acquired over 100 million users and processed more than US$5 billion in loans in 2017 alone. Wecash is looking for a stellar technologist to drive our expansion in Southeast Asia. If you can understand complex technology, navigate the fintech industry and thrive under ambiguous objectives, join us as our Data Scientist for Southeast Asia, and help us grow. The Job:  Adept in the art of cleansing, manipulation, feature extraction and analysis on large data sets Seek out external data sources for relevant context and combine external data with existing data to improve our credit and risk models Stay on top of latest developments in big data, data mining, natural language processing, machine learning and artificial intelligence techniques and technologies, while interpreting their impact and usefulness to the financial industry Design and implement machine learning-based credit and risk models and systems that can scale to serve and benefit tens of millions of customers Design elegant data visualizations to present complex analysis and insights to both internal (management) and external (customers) audiences Develop subsystems that facilitate performance tracking, analysis and ongoing optimization of implemented credit and risk models "," A proactive and diligent technologist willing to get your hands dirty with the details while possessing an innate sensitivity to data and an appreciation of proper documentation Demonstrate understanding and expertise in commonly used machine learning algorithms, feature selection techniques and data modeling processes Familiar with commonly used data mining algorithms (i.e. classification, clustering, regression, association rules, neural networks, etc.) and its principles, and is able to discuss past project experiences at length Accomplished in R, Python, SQL and other comparable programming languages Adept at choosing between Hadoop, Storm, Spark and other comparable big data technologies depending on the context, and is able to discuss past project experiences in large-scale data and log processing Master’s degree or higher, with at least a bachelor’s in Statistics, Applied Mathematics, Computer Science or other related disciplines Speak, read and write English perfectly and skillfully Ready, willing and eager for the occasional travel between Singapore, China and Indonesia "
47,3c84cf3ce7867bb71e47d830c75f3673,https://www.mycareersfuture.sg/job/business-analyst-bioquest-advisory-3c84cf3ce7867bb71e47d830c75f3673,Business Analyst,"Permanent, Full Time",BIOQUEST ADVISORY PTE. LTD.,,"Fresh/entry level, Junior Executive","Consulting , Information Technology, Professional Services",2000,5000,Monthly,13 Jan 2019,0,0,0,1,"Are you passionate about emerging technology like Artificial Intelligence and have a strong interest in doing things to merge business processes to technology? Do you enjoy meeting people, thinking on your feet to solve business challenges? BioQuest Advisory is a Singapore based consulting business led by experienced industry veterans from global technology and consulting firms. We partner our industry clients to transform their business and build sustainable growth. Our key expertise: Robotic Process Automation, Data Analytics, Business Systems Implementation, Business Strategy & Transformation, Process Improvement, Supply Chain Management, Financial Management, Governance & Risk Management. ​ Our clients consist of global MNCs and Singapore businesses spanning across multiple industries and Asia Pacific countries.   The opportunity ​BioQuest Advisory is at the exciting phase of our growth in Singapore and across APAC region and is looking for talented IT Business Analysts who are passionate about emerging technology to be part of the journey. The role You would be trained in specific technologies and be part of our business & technology advisory team to provide IT consulting services to our clients. You would work within the project team to partner our clients on an end-to-end project journey including user workshops, system analysis & design to development, testing and go-live support. Each project is uniquely customised to our client’s requirements. Your work-scope is not static but dynamic according to each project’s requirements. Consulting is an exciting and dynamic career with good exposure across industries, technologies, business practices and opportunities to work with a diverse groups  of subject experts and clients. A day in the life of our IT Business Analysts  Engaging users for user requirements gathering Provide advisory on system design best practice and work with users to derive the final system design Prepare system design documentation and do design walkthrough with users Develop system according to user requirements, frequently engaging users for clarifications Work with users to prepare test scripts and cases Conduct UAT with users and ensure issues identified are resolved Prepare for system go-live and support  What you can look forward to in this role:  Learning opportunities in cutting edge technologies Consulting career with exposure to multiple industries Collaborative and supportive work environment   ","  Your profile  Diploma/Degree in Information Technology, Computer Engineering or any other discipline with good programming training Preferably 1 year of experience programming preferably in .Net Framework (vb.NET, C#) and good understanding of Object Oriented Programming (OOP), Academic projects included Familiar with writing system documentation (system design, detail design, test plans, test execution) Passionate about programming and a career in consulting Strong analytical and problem-solving skills Good communicator, able to think-on-your-feet, have a customer service attitude Enjoy working in a team and is a good team player  Join us At BioQuest, we value collaboration, teamwork and knowledge transfers. Our culture is friendly and supportive with a strong emphasis on ethics, diversity and inclusiveness. As you grow with our firm, you would be able to leverage on your expertise to help transform our clients’ business and gain experience for your personal professional development. We are committed to providing opportunities and coaching to grow our talents. We are an equal opportunity employer.  "
48,eee4dc6032bf09138fb679ccf9018153,https://www.mycareersfuture.sg/job/research-fellow-artificial-intelligence-human-aware-decision-making-national-university-singapore-eee4dc6032bf09138fb679ccf9018153,Research Fellow in Artificial Intelligence and Human Aware Decision Making,Full Time,NATIONAL UNIVERSITY OF SINGAPORE,21 LOWER KENT RIDGE ROAD 119077,Professional,Sciences / Laboratory / R&D,5500,8000,Monthly,11 Jan 2019,0,0,0,0,"The National University of Singapore invites applications for the position of Research Fellow in the Department of Computer Science, School of Computing (SoC). SoC is strongly committed to research excellence in all its dimensions: Searching for fundamental results and insights, developing novel computational solutions to a wide range of applications, building large scale experimental systems, and improving the well-being of society. We seek to play an active role both internationally and locally in the core and emerging areas of Computer Science and Information Systems. The Research Fellow will be responsible for working closely with the Principal Investigator on one or more research projects. The research fellow will help the Principal Investigator conduct research in Artificial Intelligence (AI) by offering new theoretical perspectives on and engineering approaches to human aware decision making. In particular, the research fellow is going to explore new conceptual and computing frameworks for decision making in complex, uncertain, and changing environments. Special focus will be placed on the underlying mechanisms and dynamics of integrating learning with planning and decision making, representation change, perception, communication, and interaction in real-world environments. The candidate should possess experience or interest in at least one of the following research areas: Relational and probabilistic modelling, statistical learning with multimodal information, planning and model-based reinforcement learning, transfer learning in sequential decision processes, knowledge- and data-driven representation, computational neuroscience, computational cognitive science, and AI applications in health and education The position is available immediately. The initial term of appointment will be 1 year with possible extension to 2 years. The selected candidate will be offered strongly competitive salaries and benefits, support to travel for dissemination of research results, and substantial freedom to build a strong research profile of his/her own. Only shortlisted applicants will be notified. ",A PhD degree in relevant areas; strong system-building and management skills;  keen interests in working with emerging technologies and frameworks; good communications skill in both written and verbal English.  
