,Job ID,URL,Job Title,Job Type,Company Name,Job Location,Job Level,Job Industry,Min Salary,Max Salary,Salary Paid,Date Posted,Contract,Internship,Temporary,Permanent,Job Description,Job Requirements
63,952541ff26aba4d294d73ad80645597c,https://www.mycareersfuture.sg/job/senior-associate-ai-deployment-engineer-ibg-digital-institutional-banking-group-dbs-bank-952541ff26aba4d294d73ad80645597c,"Senior Associate, AI Deployment Engineer, IBG Digital, Institutional Banking Group (180004A2)","Permanent, Full Time",DBS BANK LTD.,,"Manager, Senior Executive",Banking and Finance,5000,9000,Monthly,09 Jan 2019,0,0,0,1,"Job Purpose  The AI (Artificial Intelligence) Deployment Engineer will provide software engineering support to the Institutional Banking Group (IBG) Business Analytics Team in various data science projects. This role’s primary job responsibility is facilitating the wrapping of data science work into a viable product. The right candidate will be one excited by opportunities to apply software engineering in the fast-growing area of AI, help build AI development and production infrastructure, as well as to set technical standards. Responsibilities  Build, manage and automate pipelines for AI model development Adopt maintainable, readable, modular solutions using modern software engineering best practices Transform Data Science work into pilot and minimum viable products Perform code optimization, code reviews to improve the quality of Data Scientist’s work Create APIs for integrate data source into applications Create APIs for downstream usage of AI models Create visualisations to display views of AI models Keep track of model development iterations with a versioning control system  Automate software testing: unit test, branch test, integration test and security test  Monitor AI model releases, branches for different issues and user stories "," Master’s Degree in software Engineering, Computer Science or related fields with minimum 5 years software engineering work experience on enterprise products Experience with multi-tier software application development with best software engineering practices Familiar with tools such as Anaconda, Jupyter, Eclipse, R Studio, Jira, Git, SVN, Jenkins, etc Demonstrated proficiency in Python (Pandas, SciPy, NumPy, PySpark, etc), Scala, R, Java, Java Script, SQL, Shell Script  Experience with big data stack (Hadoop, Spark, Kafka, etc), and structured (SQL) and unstructured databases (Graph Database, NoSQL) Experience with virtual computing (virtual machine and Docker) for creation of easily transportable and self-contained environments Experience with converting AI models and integrating them into production Experience with code reviews, building interfaces, and deployment systems Demonstrated strong interests in learning about AI through own initiatives "
64,2980885240e51919ecd133cbe8905784,https://www.mycareersfuture.sg/job/product-application-specialist-linx-singapore-2980885240e51919ecd133cbe8905784,Product Application Specialist,"Permanent, Full Time",LINX SINGAPORE PTE. LTD.,"TANNERY HOUSE, 37 TANNERY LANE 347790",Professional,Engineering,,,,08 Jan 2019,0,0,0,1,"Primary responsibility is to manage and promote key technical product lines by providing Application support to customers  Evaluating and establishing performance specifications of key products in customers’ field applications. Working with the pre-sales team to specify the requirements and product specifications. Regularly review and research technological products based on business needs Train customer in adoption of Machine Vision and automation products. Knowledge of C, C++ , C#  or other programming languages / environments To understand and master equipment in Advanced Automation, Robotics, Artificial Intelligence Industry constantly To assist in Marketing of new Product LINEs in Exhibitions and Roadshows. 10-15% Overseas travel required to support partner and projects site ", Diploma/ Degree in  Computer Science/Electrical Engineering /Electronics/Mechanical  Engineering/Computer Engineering or equivalent 2-3 years working experience. Fresh graduates are weclome Working as a good team player as part of the Engineering Team to give ideas and excellent support to customers Independent player who is able to execute assigned tasks with little supervision. Ability to work in a fast paced and dynamic environment is required. Good communication skills in English. 
65,1bf95d32ba7a044b23363fed1d12abba,https://www.mycareersfuture.sg/job/assistant-manager-government-technology-agency-1bf95d32ba7a044b23363fed1d12abba,Assistant Manager (Events and Planning),Full Time,GOVERNMENT TECHNOLOGY AGENCY,"MAPLETREE BUSINESS CITY, 10 PASIR PANJANG ROAD 117438",Middle Management,"Events / Promotions , Public / Civil Service",5000,8000,Monthly,08 Jan 2019,0,0,0,0,"As an Assistant Manager (Events and Planning) in GovTech’s Data Science & Artificial Intelligence Division, you will be responsible for the successful execution of various edifying events and initiatives such as training workshops, seminars, competitions, and meet-up sessions.  You are an organized individual with a great attention to detail that is needed to run an event smoothly. The role requires you to work independently to execute events of a smaller scale, and to collaborate with partners, stakeholders, and events companies to coordinate the agenda and logistics for larger-scale events. What to Expect:   Co-conceptualise with your team to deliver the schedule of Capability Development events Source for good vendors and partners that can help deliver the best experience for the events, while ensuring financial prudence and working within the constraints of government procurement rules Ensure logistics are smooth from the pre-event phase (e.g. bookings and invitations), to the event phase (e.g. time-keeping and F&B), to the post-event phase (e.g. feedback and recommendations) Manage and track the overall Capability Development efforts in the team through the use of spreadsheets and dashboards Assist the division on any other events and logistics matters  How to Succeed:   Degree or Diploma in Marketing, Mass Communications or a related field will be an added advantage Experience with the government procurement process will be an added advantage Experience in development and running of events, from conceptualisation to execution, to the post-event phase Resourceful and has a strong ability to function under pressure Excellent English language skills, both oral and written Comfortable to work independently with minimum supervision ",None
66,c98079b6cb6790d93323dfa66296d67b,https://www.mycareersfuture.sg/job/data-science-ai-programme-manager-government-technology-agency-c98079b6cb6790d93323dfa66296d67b,Data Science & AI Programme Manager,Full Time,GOVERNMENT TECHNOLOGY AGENCY,"MAPLETREE BUSINESS CITY, 10 PASIR PANJANG ROAD 117438",Middle Management,"Information Technology, Public / Civil Service",5000,8000,Monthly,08 Jan 2019,0,0,0,0,"As a Programme Manager in GovTech’s Data Science & Artificial Intelligence Division, you will drive innovative initiatives that build analytics capabilities across the Whole-of-Government. You will use levers such as apprenticeship programmes, get industry players to contribute resources to the capability development efforts, and put in place bulk tender procurement for government agencies to tap on for their analytics needs. You are a decisive and driven individual who takes a proactive approach to running programmes and managing projects to meet overall objectives and targets of the organisation. Success in the role will be demonstrated by your ability to effectively deal with dynamic situations while keeping to achieve impactful outcomes that are aligned to the overall strategy of levelling up Data Science capabilities across the Whole-of-Government. What to Expect:   Drive multiple projects concurrently with the overall aim to improve capabilities of public officers across the Whole-of-Government in Data Science Develop a strategic sense of key organisations, software and hardware tools, methodologies and best practices in the Data Science & AI landscape Forge strong partnerships with such key industry players to gain support and involvement in capability development efforts Collaborate with organisations and invite luminaries to engage the Data Science & AI community of public officers through training workshops, sharing sessions, and masterclasses on Data Science-related skills Strategize, call and maintain the bulk tender options of Data Science & AI tools for the Whole-of-Government to tap on Manage all aspects of assigned projects independently, including—but not limited to—programme execution and budgeting  How to Succeed:   Degree or Diploma in Computer Science, Information Technology or the equivalent Minimum 3 years of relevant experience in IT consulting/project management or business analytics Experience working on large-scale projects from conception to implementation, handling all aspects from planning to budgeting, to stakeholder management Good understanding of procurement processes, especially in a government context Confident in public speaking to a diverse audience group from staff level to senior executives Strong understanding of the different elements of Data Science & AI, Big Data architecture, and the common tools and products associated with it Excellent English language skills, both oral and written Comfortable to work independently with minimum supervision Knowledge of Data Science tools, experience working in Data Science & AI domain, or prior experience in engaging public officers and government agencies on projects and collaborations is an added advantage ",None
67,210401adb688b2b95739461400c05d1a,https://www.mycareersfuture.sg/job/vision-engineer-aem-singapore-210401adb688b2b95739461400c05d1a,Vision Engineer,Full Time,AEM SINGAPORE PTE. LTD.,52 SERANGOON NORTH AVENUE 4 555853,Executive,Engineering,2500,5000,Monthly,08 Jan 2019,0,0,0,0,"AEM is planning to invest in the smart automation business, notably integrated vision solutions.  Vision is of key importance in Industry 4.0 and beyond. Think of autonomous vehicles and 5G manufacturing, and you get an idea of how important vision systems will be in the future. Our technical team needs to develop applications solutions for customers and often to integrate these with other aspects of automation. The candidate is expected to expose to Artificial Intelligence, data analytics, optimization. There will be opportunities for the individual to acquire new knowledge in and through the Organization. The candidate must be self-starters, easily bored with the routine, always eager to try new things, not easily demoralized by setbacks, a team player yet with leadership potential.    "," Bachelor Degree in Mechanical Engineering or related technical disciplines Minimum 2 years' working experiences in equipment design for semiconductor Strong fundamentals in mechanical, physics, optics and C programming knowledge Very strong motivation in finding new solutions to new problems Self motivated individual who is action/results oriented, independent, flexible, with a passion for developing technical excellence products Must be prepared to get hands-on during development cycle Excellent communication skills, with cross-cultural awareness and understanding "
68,8547ce77e5070ab75ce4ab45584121b3,https://www.mycareersfuture.sg/job/research-fellow-postdoctoral-fellow-research-associate-research-assistant-national-university-singapore-8547ce77e5070ab75ce4ab45584121b3,"Research Fellow / Postdoctoral Fellow, Research Associate and Research Assistant",Contract,NATIONAL UNIVERSITY OF SINGAPORE,21 LOWER KENT RIDGE ROAD 119077,Professional,Sciences / Laboratory / R&D,3000,5000,Monthly,08 Jan 2019,1,0,0,0,"Research Fellow/Postdoctoral Fellow, Research Associate and Research Assistant  For “Healthcare Artificial Intelligence and Data Analytics” The above positions are now available to support the Principal Investigator, Assistant Professor Feng Mengling, for his research in the areas of healthcare data analytics and AI solutions.   Dr. Mengling Feng (http://web.mit.edu/mfeng/www/) is truly a cross-disciplinary scientists, who is currently a faculty member of the School of Public Health, School of Computing and School of Medicine, National University of Singapore (NUS). He is also the Senior Assistant Director working directly with the Chief Technology Officer (CTO) and Chief Medical Information Officer (CMIO) at National University Hospital (NUH). Dr. Feng is also an affiliated scientist with MIT. His research is to develop effective data analysis and machine learning methods to extract actionable knowledge from medical big data to improve the quality of care. Dr. Feng’s work was recognized by both well-established journals, such as Science Translational Medicine, and top international conferences, such as KDD, AAAI and AMIA.   Cross-disciplinary and International AI Lab The selected candidates will be working in a cross-disciplinary team consists of data scientists, physicians, post-docs, PhD students and well respected faculty members from NUS, NUH and SGH. The candidates will be working on healthcare projects funded by our Ministry of Health, Health Promotion Board and AI Singapore. As Dr. Feng is an affiliated scientist, his lab constantly work with faculties and students from the Harvard-MIT Health Science Technology division. Dr. Feng has over 10 joint publications with Harvard and MIT between 2017 and 2018. He has also been organizing the annual NUS-MIT Healthcare AI Datathon (www.nus-datathon.com).   Potential Industrial and Overseas Exposure Dr. Feng also collaborates closely with various local and international industrial partners. Therefore, members in Dr. Feng’s team often have opportunities to work as affiliated scientists in our partnering companies, such as MSD, IBM, SAP, Philips, local and international start-ups.   Responsibilities and requirements Major responsibility of the selected candidate is to apply and develop machine learning and AI technologies to solve healthcare challenges raised by our clinical collaborators. The selected candidate will also be involved in managing, extracting and pre-processing data for various projects.","Required personal skills:  An independent and self-driven worker and a fast learner Well- organized and has an eye for details Excellent written and verbal communication skills Ability to work effectively with colleagues to achieve team goals    Essential technical skills:    Excellent academic record Knowledge and experience in statistical analysis or machine learning Programing language: Python or R or C++     Good proficiency and experience in the following areas is a plus:  Experience with the PL-SQL/Trans-SQL Knowledge and experience in GPU-based computation Strong in Mathematics    The successful applicants are expected to possess at least the Bachelor’s Degree in Computer Science, Engineering, Mathematics, Statistics, and preferably with relevant experience.   This position will be initially available for one year. The grade of appointment will be accorded based on candidate’s academic qualifications and years of relevant experience. Recruitment is open immediately, and will continue until the positions are filled. To apply please email the following to Dr. Feng at ephfm@nus.edu.sg or morning@gmail.com    Cover letter highlighting career goals and relevant experience Curriculum Vitae, containing details of three named referees "
69,afe44c29a483bbfece8397c5747315e3,https://www.mycareersfuture.sg/job/research-associate-national-university-singapore-afe44c29a483bbfece8397c5747315e3,Research Associate,"Contract, Full Time",NATIONAL UNIVERSITY OF SINGAPORE,21 LOWER KENT RIDGE ROAD 119077,Non-executive,Sciences / Laboratory / R&D,3400,5000,Monthly,07 Jan 2019,1,0,0,0,"We are seeking a research associate (RA) who is capable in both deep learning and drug discovery. Our lab focuses on artificial intelligence (AI) aided drug discovery. AI, especially deep learning, exhibits unprecedented capabilities in sequence/image-based learning tasks in several research fields including biology and biomedicine. However, the applications of deep learning in drug discovery (learning tasks on heterogeneous data types) has not been fully exploited. To resolve key questions in drug discovery, our team focuses on developing innovative deep learning methods and novel visualization software for visualizing & analyzing deep learning results. The RA is expected to develop a 3-dimensional visualization software which will be used to visualize (with elegant graphical interface) and analyze deep learning results. The visualization software should be able to be integrated with our deep learning platform which includes drug activity prediction, drug ADMET prediction, smart drug molecule design, small molecule structural optimization and etc. The integrated platform will be provided as a free web server for public access. This will be a 1-year job contract, based on department of pharmacy, National University of Singapore."," PhD in any of bioinformatics, computational biology, or other related disciplines from a prestigious university Strong publication records in relative research fields Strong background in bioinformatics, machine learning, deep learning, and data mining Knowledge in biology, drug discovery, and drug development Strong skills in programing language (Perl/Python/R etc.), database and web server development (SQL, HTML, PHP, and JavaScript) Good team player, quick learner, and good interpersonal skills "
70,1bf66777092916d8541983a50dbc1ec5,https://www.mycareersfuture.sg/job/software-engineer-university-graduate-2019-start-singapore-google-asia-pacific-1bf66777092916d8541983a50dbc1ec5,"Software Engineer, University Graduate, 2019 Start - Singapore",Full Time,GOOGLE ASIA PACIFIC PTE. LTD.,"MARINA BAY FINANCIAL CENTRE, 8 MARINA BOULEVARD 018981",Junior Executive,Engineering,5100,10200,Monthly,07 Jan 2019,0,0,0,0,"Company overview: Google is not a conventional company, and we don’t intend to become one. True, we share attributes with the world’s most successful organizations – a focus on innovation and smart business practices comes to mind – but even as we continue to grow, we’re committed to retaining a small-company feel. At Google, we know that every employee has something important to say, and that every employee is integral to our success. We provide individually-tailored compensation packages that can be comprised of competitive salary, bonus, and equity components, along with the opportunity to earn further financial bonuses and rewards. Googlers thrive in small, focused teams and high-energy environments, believe in the ability of technology to change the world, and are as passionate about their lives as they are about their work. For more information, visit www.google.com/careers. The area: Engineering & Operations Google is and always will be an engineering company. We hire people with a broad set of technical skills who are ready to take on some of technology's greatest challenges and make an impact on millions, if not billions, of users. At Google, engineers not only revolutionize search, they routinely work on massive scalability and storage solutions, large-scale applications and entirely new platforms for developers around the world. From Google Ads to Chrome, Android to YouTube, Social to Local, Google engineers are changing the world one technological achievement after another. The role: Software Engineer, University Graduate, 2019 Start - Singapore Google's software engineers develop the next-generation technologies that change how billions of users connect, explore, and interact with information and one another. Our products need to handle information at massive scale, and extend well beyond web search. We're looking for engineers who bring fresh ideas from all areas, including information retrieval, distributed computing, large-scale system design, networking and data storage, security, artificial intelligence, natural language processing, UI design and mobile; the list goes on and is growing every day. As a software engineer, you will work on a specific project critical to Google’s needs with opportunities to switch teams and projects as you and our fast-paced business grow and evolve. We need our engineers to be versatile, display leadership qualities and be enthusiastic to tackle new problems across the full-stack as we continue to push technology forward.As a key member of a small and versatile team, you design, test, deploy and maintain software solutions. Additional Role Description: Our team will review applications on a rolling basis and will reach out to shortlisted applicants only. We appreciate your patience while we consider your application.  Responsibilities: - Specific responsibilities vary by project area. General responsibilities include: Develop scripts to automate routine tasks while also reading and reviewing others’ code to provide feedback. - Analyze information and evaluate results to choose the best solution to effectively solve problems. - Mitigate reliability failures in a component or system. - Create and support a productive and innovative team. This includes working with peers, managers, and teams. - Take on tasks as requested, following through to completion despite roadblocks or distractions.","Minimum qualifications: - BA/BS degree in Computer Science or related technical field, or equivalent practical experience. - Experience in writing code fixes and tools to solve problems in C, C++, C#, Java, JavaScript, Go or Python (e.g., removing duplicate elements from a list) and experience in optimizing code for stability, functionality and scalability (e.g., crawling, search, troubleshooting). - Experience or previous project assignments with Data Structures and Algorithms (i.e. selecting and implementing an algorithm, using data structures to solve a problem.) Experience creating algorithms that improve a product’s capabilities, speed, efficiency, or reliability. - Experience with data structures, branching, function-calls, and conditionals as well as debugging code and submitting the appropriate fix. Preferred qualifications: - Previous tech internships or relevant work experience programming in C, C++, C#, Java, JavaScript, Go or Python. - Experience developing thorough testing solutions across testing layers (e.g., unit, functional, integration, stress testing) for your code, using one or more of the following: C, C++, C#, Java, JavaScript, Go, or Python. - Demonstrated experience programming in 2 or more of the above languages: C, C++, C#, Java, JavaScript, Go or Python. - Experience manipulating code to improve system availability and latency; Experience with improving inventing or proving the value of new algorithms that improve a product's capabilities, speed, efficiency and reliability. - Skill in isolating problems to a database subsystem."
71,f299d8613e911ccbf99c394275f436fa,https://www.mycareersfuture.sg/job/pm-pmo-synechron-business-consulting-f299d8613e911ccbf99c394275f436fa,PM  / PMO,Permanent,SYNECHRON BUSINESS CONSULTING PTE. LTD.,,"Manager, Professional",Banking and Finance,6000,20000,Monthly,07 Jan 2019,0,0,0,1,"Synechron draws on over 17 years of financial services IT consulting experience to provide expert systems integration expertise and technical development work in highly-complex areas within financial services this making it one of the fastest-growing digital, business consulting & technology firms around the world.  Headquartered in New York and with 18 offices around the world, Synechron has limitless opportunities for our ambitious and innovative employees to contribute to our growth story.  We are embracing the most cutting-edge innovations in areas like Blockchain, Artificial intelligence ,Machine learning and Cloud Computing as well as delivering end-to-end Consulting, Technology, and front-to-back application design capability that allows us to see a project through from start-to-finish as a trusted advisor and partner to our clients, this allowing our people to work on the most industry-leading initiatives that will shape the future of the financial services industry. This has helped us to grow to $500+ million in annual revenue and 8,000 employees, and we’ve set an ambitious target to be a $1B company by 2020","PM/PMO Role  4+ years relevant work experience Experience in Vendor and Contract Management, ITO Sourcing, market analysis, reporting, etc. Experience in cross-functional stakeholder management Good communication skills Techno-functional PM/PMO who can with various stakeholders for any data gathering, action follow-ups, updates, meetings Independent worker Excel skills a must "
